{
  "apiVersion": "punar.dev/v1alpha1",
  "kind": "ProjectEnvironment",
  "project": { "name": "atlas" },
  "environment": { "type": "devcontainer" },
  "toolchains": { "node": "24", "rust": "stable" },
  "services": ["postgres"],
  "ai": { "agents": ["claude-code", "codex"] },
  "permissions": {
    "filesystem": { "project": "read_write" },
    "network": { "internet": "allow", "corp_dev": "allow", "corp_prod": "deny" },
    "credentials": { "github": "allow", "aws_dev": "request", "aws_prod": "deny" }
  }
}
